[
  {
    "areas": [
      "probability",
      "asymptotic-statistics",
      "causal-identification"
    ],
    "catalog": "catalog/works/P001.json",
    "counts": {
      "counterexample_proved": 41,
      "proved": 260,
      "results": 301,
      "targets": 128
    },
    "docs": "docs/works/P001.md",
    "work": {
      "arxiv_id": null,
      "authors": [
        "P. M. Aronow",
        "Benjamin T. Miller"
      ],
      "citation": "P. M. Aronow and Benjamin T. Miller (2019). Foundations of Agnostic Statistics. Cambridge University Press.",
      "doi": "10.1017/9781316831762",
      "title": "Foundations of Agnostic Statistics",
      "type": "Book",
      "venue": "Cambridge University Press",
      "year": "2019"
    },
    "work_id": "P001"
  },
  {
    "areas": [
      "randomization-inference",
      "causal-identification",
      "optimization-and-computation"
    ],
    "catalog": "catalog/works/P002.json",
    "counts": {
      "counterexample_proved": 10,
      "proved": 114,
      "results": 124,
      "targets": 30
    },
    "docs": "docs/works/P002.md",
    "work": {
      "arxiv_id": "2404.18786",
      "authors": [
        "P. M. Aronow",
        "Haoge Chang",
        "Patrick Lopatto"
      ],
      "citation": "P. M. Aronow, Haoge Chang, and Patrick Lopatto (2026). Randomization-based confidence sets for the local average treatment effect. Biometrika 113(2):asag010.",
      "doi": "10.1093/biomet/asag010",
      "title": "Randomization-based confidence sets for the local average treatment effect",
      "type": "Journal article",
      "venue": "Biometrika",
      "year": "2026"
    },
    "work_id": "P002"
  },
  {
    "areas": [
      "randomization-inference",
      "experimental-design-and-estimation",
      "optimization-and-computation"
    ],
    "catalog": "catalog/works/P003.json",
    "counts": {
      "counterexample_proved": 7,
      "proved": 105,
      "results": 112,
      "targets": 35
    },
    "docs": "docs/works/P003.md",
    "work": {
      "arxiv_id": "2305.09906",
      "authors": [
        "P. M. Aronow",
        "Haoge Chang",
        "Patrick Lopatto"
      ],
      "citation": "P. M. Aronow, Haoge Chang, and Patrick Lopatto (2025). Fast computation of exact confidence intervals for randomized experiments with binary outcomes. Journal of Econometrics 251:106056.",
      "doi": "10.1016/j.jeconom.2025.106056",
      "title": "Fast computation of exact confidence intervals for randomized experiments with binary outcomes",
      "type": "Journal article",
      "venue": "Journal of Econometrics",
      "year": "2025"
    },
    "work_id": "P003"
  },
  {
    "areas": [
      "interference-and-networks",
      "experimental-design-and-estimation",
      "asymptotic-statistics"
    ],
    "catalog": "catalog/works/P004.json",
    "counts": {
      "counterexample_proved": 8,
      "proved": 118,
      "results": 126,
      "targets": 43
    },
    "docs": "docs/works/P004.md",
    "work": {
      "arxiv_id": "2010.13599",
      "authors": [
        "Ye Wang",
        "Cyrus Samii",
        "Haoge Chang",
        "P. M. Aronow"
      ],
      "citation": "Ye Wang, Cyrus Samii, Haoge Chang, and P. M. Aronow (2025). Design-Based Inference for Spatial Experiments under Unknown Interference. Annals of Applied Statistics 19(1):744–768.",
      "doi": "10.1214/24-AOAS1986",
      "title": "Design-Based Inference for Spatial Experiments under Unknown Interference",
      "type": "Journal article",
      "venue": "Annals of Applied Statistics",
      "year": "2025"
    },
    "work_id": "P004"
  },
  {
    "areas": [
      "experimental-design-and-estimation",
      "regression-and-variance-estimation",
      "asymptotic-statistics"
    ],
    "catalog": "catalog/works/P005.json",
    "counts": {
      "counterexample_proved": 7,
      "proved": 87,
      "results": 94,
      "targets": 27
    },
    "docs": "docs/works/P005.md",
    "work": {
      "arxiv_id": "2110.08425",
      "authors": [
        "Haoge Chang",
        "Joel A. Middleton",
        "P. M. Aronow"
      ],
      "citation": "Haoge Chang, Joel A. Middleton, and P. M. Aronow (2024). Exact Bias Correction for Linear Adjustment of Randomized Controlled Trials. Econometrica 92(5):1503–1519.",
      "doi": "10.3982/ECTA20289",
      "title": "Exact Bias Correction for Linear Adjustment of Randomized Controlled Trials",
      "type": "Journal article",
      "venue": "Econometrica",
      "year": "2024"
    },
    "work_id": "P005"
  },
  {
    "areas": [
      "causal-identification",
      "optimization-and-computation"
    ],
    "catalog": "catalog/works/P006.json",
    "counts": {
      "counterexample_proved": 13,
      "proved": 81,
      "results": 94,
      "targets": 30
    },
    "docs": "docs/works/P006.md",
    "work": {
      "arxiv_id": "2305.14595",
      "authors": [
        "Serena Wang",
        "Stephen Bates",
        "P. M. Aronow",
        "Michael I. Jordan"
      ],
      "citation": "Serena Wang, Stephen Bates, P. M. Aronow, and Michael I. Jordan (2024). On Counterfactual Metrics for Social Welfare: Incentives, Ranking, and Information Asymmetry. AISTATS 2024 PMLR 238:1522–1530.",
      "doi": null,
      "title": "On Counterfactual Metrics for Social Welfare: Incentives, Ranking, and Information Asymmetry",
      "type": "Conference paper",
      "venue": "AISTATS 2024",
      "year": "2024"
    },
    "work_id": "P006"
  },
  {
    "areas": [
      "probability",
      "asymptotic-statistics"
    ],
    "catalog": "catalog/works/P007.json",
    "counts": {
      "counterexample_proved": 14,
      "proved": 47,
      "results": 61,
      "targets": 17
    },
    "docs": "docs/works/P007.md",
    "work": {
      "arxiv_id": "2101.11470",
      "authors": [
        "J. Sophia Wang",
        "P. M. Aronow"
      ],
      "citation": "J. Sophia Wang and P. M. Aronow (2023). Listwise Deletion in High Dimensions. Political Analysis 31(1):149–155.",
      "doi": "10.1017/pan.2022.5",
      "title": "Listwise Deletion in High Dimensions",
      "type": "Journal article",
      "venue": "Political Analysis",
      "year": "2023"
    },
    "work_id": "P007"
  },
  {
    "areas": [
      "interference-and-networks",
      "randomization-inference",
      "regression-and-variance-estimation"
    ],
    "catalog": "catalog/works/P008.json",
    "counts": {
      "counterexample_proved": 26,
      "proved": 136,
      "results": 162,
      "targets": 28
    },
    "docs": "docs/works/P008.md",
    "work": {
      "arxiv_id": "2106.15081",
      "authors": [
        "Cyrus Samii",
        "Ye Wang",
        "Jonathan Sullivan",
        "P. M. Aronow"
      ],
      "citation": "Cyrus Samii, Ye Wang, Jonathan Sullivan, and P. M. Aronow (2023). Inference in Spatial Experiments with Interference using the SpatialEffect Package. Journal of Agricultural, Biological, and Environmental Statistics 28(1):138–156.",
      "doi": "10.1007/s13253-022-00517-y",
      "title": "Inference in Spatial Experiments with Interference using the SpatialEffect Package",
      "type": "Journal article",
      "venue": "Journal of Agricultural, Biological, and Environmental Statistics",
      "year": "2023"
    },
    "work_id": "P008"
  },
  {
    "areas": [
      "interference-and-networks",
      "experimental-design-and-estimation",
      "asymptotic-statistics"
    ],
    "catalog": "catalog/works/P009.json",
    "counts": {
      "counterexample_proved": 10,
      "proved": 111,
      "results": 121,
      "targets": 51
    },
    "docs": "docs/works/P009.md",
    "work": {
      "arxiv_id": "1711.06399",
      "authors": [
        "Fredrik Sävje",
        "P. M. Aronow",
        "Michael G. Hudgens"
      ],
      "citation": "Fredrik Sävje, P. M. Aronow, and Michael G. Hudgens (2021). Average treatment effects in the presence of unknown interference. Annals of Statistics 49(2):673–701.",
      "doi": "10.1214/20-AOS1973",
      "title": "Average treatment effects in the presence of unknown interference",
      "type": "Journal article",
      "venue": "Annals of Statistics",
      "year": "2021"
    },
    "work_id": "P009"
  },
  {
    "areas": [
      "causal-identification",
      "partial-identification-and-bounds",
      "experimental-design-and-estimation"
    ],
    "catalog": "catalog/works/P010.json",
    "counts": {
      "counterexample_proved": 4,
      "proved": 37,
      "results": 41,
      "targets": 23
    },
    "docs": "docs/works/P010.md",
    "work": {
      "arxiv_id": null,
      "authors": [
        "P. M. Aronow",
        "Jonathon Baron",
        "Lauren Pinson"
      ],
      "citation": "P. M. Aronow, Jonathon Baron, and Lauren Pinson (2019). A Note on Dropping Experimental Subjects who Fail a Manipulation Check. Political Analysis 27(4):572–589.",
      "doi": "10.1017/pan.2019.5",
      "title": "A Note on Dropping Experimental Subjects who Fail a Manipulation Check",
      "type": "Journal article",
      "venue": "Political Analysis",
      "year": "2019"
    },
    "work_id": "P010"
  },
  {
    "areas": [
      "interference-and-networks",
      "regression-and-variance-estimation",
      "optimization-and-computation"
    ],
    "catalog": "catalog/works/P011.json",
    "counts": {
      "counterexample_proved": 9,
      "proved": 125,
      "results": 134,
      "targets": 41
    },
    "docs": "docs/works/P011.md",
    "work": {
      "arxiv_id": "1602.00359",
      "authors": [
        "P. M. Aronow",
        "Forrest W. Crawford",
        "Jose R. Zubizarreta"
      ],
      "citation": "P. M. Aronow, Forrest W. Crawford, and Jose R. Zubizarreta (2018). Confidence Intervals for Linear Unbiased Estimators under Constrained Dependence. Electronic Journal of Statistics 12(2):2238–2252.",
      "doi": "10.1214/18-ejs1448",
      "title": "Confidence Intervals for Linear Unbiased Estimators under Constrained Dependence",
      "type": "Journal article",